{
  "schema_version": 1,
  "ticker": "CPB",
  "period": "2025-FY",
  "period_start": "2024-07-29",
  "period_end": "2025-08-03",
  "period_type": "annual",
  "currency": "USD",
  "default_source_id": "sec-0000016732-25-000112",
  "metrics": [
    {
      "metric_id": "ebitda_amount",
      "name": "Issuer-Reported EBITDA",
      "value": null,
      "unit": "million_usd",
      "data_type": "direct",
      "status": "unavailable",
      "reason": "issuer_reported_ebitda_not_found",
      "notes": "No unique issuer-reported fact was found in accession-specific SEC 8-K exhibits."
    },
    {
      "metric_id": "net_debt_apm_amount",
      "name": "Issuer-Reported Net Debt APM",
      "value": null,
      "unit": "million_usd",
      "data_type": "direct",
      "status": "unavailable",
      "reason": "issuer_reported_net_debt_apm_not_found",
      "notes": "No unique issuer-reported fact was found in accession-specific SEC 8-K exhibits."
    }
  ]
}
